error_code;description
989318;Invalid SecurityRequestType 
989319;Invalid Sender Location 
989320;Unknown Quote 
989321;QuoteID/QuoteReqID not found 
989322;Invalid PositionQty 
989323;Contra Firm not found 
989324;This session is not allowed to perform the requested operation 
989325;This Order Validity can only be associated with Market Orders 
989326;Order Validity At the Close not allowed 
989327;Trying to set the field: <NAME> with value: <VALUE> which is narrower in length than the field declaration: <LENGTH>. The data type: <DATA_TYPE> cannot be padded 
989328;Trying to set the field: <NAME> with value: <VALUE> which is wider in length than the field declaration: <LENGTH> 
989329;Message <MESSAGE_NAME> was not found in the data dictionary 
989330;Incorrect MMTP timestamp format 
989331;Decimal locator is wider than 1 char: <DECIMAL_LOCATOR> 
989332;Invalid decimal locator: <DECIMAL_LOCATOR> 
989333;Price Vs. Decimal Locator count mismatch 
989334;The function code position has an invalid value: <VALUE>. It should be greater or equal to 1, and smaller than the message length 
989335;Cannot create unknown message: <MESSAGE_NAME> 
989336;Mapping not found for value: <VALUE> 
989337;Mapping not found for value: <VALUE> 
989338;Unsupported target <NAME> 
989339;Error in alternate-source-format: <EXCEPTION> 
989340;Error in source-format: <EXCEPTION> 
989341;Index <POSITION> is larger than the current field width 
989342;Length <LENGTH> is larger than the current field width 
989343;Input price invalid: <VALUE> 
989344;The price overflows the maximum MMTP price width (9) <VALUE> 
989345;Invalid Session name, it should end with valid numeric content (EntryPoint) 
989346;This FIX session is not a valid Desk session (EntryPoint) 
989347;Fixed Rate value must be between 0 and 1 
990292;Número de Cliente Inválido (Invalid account number) 
991000;This instrument doesn’t exist 
991001;Unknown function  
991002;Forbidden function for broker type  
991003;Group state doesn’t allow this function   
991004;Instrument state doesn’t allow this function    
991005;Quantities must be numeric    
991006;Price format is not valid 
991007;A mandatory area is not or bad filled 
991008;Invalid Hour area format 
991009;Group not authorized for this broker 
991010;Mandatory field is not filled 
991011;Field is bad filled 
991012;Unknown group of instrument   
991013;Tick expression format is invalid   
991014;This instrument doesn’t allow this function 
991015;Instrument must belong to BOO group 
991016;Only one broker authorized on buy side for BOO group  
991017;Broker not authorized to enter an order on this side of BOO Group 
991018;The Group is already a BOO Group    
991019;The Group is already a non-BOO Group 
991020;Min Price is Mandatory  
991021;Tick Limit Modification is invalid  
991022;BOO group action code is bad filled 
991023;The Group must not contain instruments    
991024;Valuation indicator group must be 0 or 1  
991025;Valuation indicator unchanged 
991026;SLE code already exists in Database 
991027;Field ORDER DISCLOSED QUANTITY is bad filled    
991028;Field MEMBER ID is bad filled 
991029;Field TECHNICAL ORIGIN is bad filled 
991030;Field ORDER CONFIRMATION FLAG is bad filled 
991031;Field PREOPENING ORDER FLAG is bad filled 
991032;Field ORIGINAL TRIGGER PRICE is bad filled 
991033;Field ORDER VALIDITY DURATION is bad filled 
991034;Field TYPE OF CLEARING ACCOUNT is bad filled    
991035;Field CLIENT ACCOUNT NUMBER is bad filled 
991036;Field CLIENT ACCOUNT NUMBER must be filled for CLIENT orders 
991037;Field TRADE ORDER NUMBER is bad filled    
991038;Field ORIGINAL ORDER DATE is bad filled   
991039;Field BRANCH CODE is bad filled 
991040;Field BANK CODE is different from MEMBER ID 
991041;Field TYPE OF CLEARING ACCOUNT (2nd ag) is bad filled 
991042;Field CLIENT ACCOUNT NUMBER (2nd ag) is bad filled    
991043;Field CLIENT ACCOUNT NUMBER (2nd ag) must be filled for CLIENT orders   
991044;Field TRADE ORDER NUMBER (2nd ag) is bad filled 
991045;Field ORIGINAL ORDER DATE (2nd ag) is bad filled 
991046;Field BRANCH CODE (2nd ag) is bad filled  
991047;Field BANK CODE (2nd ag) is different from MEMBER ID  
991048;ACCOUNT is not active   
991049;ACCOUNT (2nd ag) is not active 
991050;Field CLIENT ACCOUNT NUMBER is bad filled 
991051;Either BANK CODE or BRANCH CODE is filled with blank  
991052;Price is invalid according to quotation range   
991053;Reference Price is invalid according to quotation range 
991054;One threshold is invalid according to quotation range 
991055;Field <ID of clearing system member> (1st ag) is bad filled 
991056;Filler (1st ag) contains binary data 
991057;Field <Free Text> (1st ag) contains binary data 
991058;Field <Posting action for an order> (1st ag) is bad filled  
991059;Field <Clearing of operation mode> (1st ag) is bad filled   
991060;Field <ID of clearing system member> (2nd ag) is bad filled 
991061;Filler (2nd ag) contains binary data 
991062;Field <Free Text> (2nd ag) contains binary data 
991063;Field <Posting action for an order> (2nd ag) is bad filled  
991064;Field <Clearing of operation mode> (2nd ag) is bad filled   
991065;Field <short sell indicator> is bad filled 
991500;Insufficient balance for designated instrument  
991501;Nationality group cannot own more than n% 
991502;Investor category cannot own more than n% 
991503;Trader cannot trade more than a certain amount  
991504;Investor suspended 
991505;Investor status invalid it must be filled with - 00 01 02 03 
991506;Investor/Broker does not hold enough qty to sell order 
991507;Investor suspended in bid side 
991508;Investor suspended in ask side 
991509;Order origin does not match the account origin  
991510;Investor not found in link investor / account   
991511;Unknown Investor in credit check data base 
991512;Unknown broker indicators in credit check data base   
991513;No broker/account found in credit check data base (tccpositions)  
991518;Short sell qty to decrement is greater than total qty owned 
991519;Ownership qty to decrement is greater than total qty owned  
991520;No %Ownership for this instrument   
991521;This instrument does not exist in stock check control 
991522;No Short-selling positions for this instrument  
991523;Credit Limit Cap exceeded 
991524;Credit Limit information does not exist  
991525;Held quantity of shares is insufficient   
991526;Held qty of shares is insufficient - broker not authorized for SS 
991527;Investor suspended but cancel of all its orders not completely performed 
991528;The order cannot be modified nor cancelled until its exposure time has elapsed 
991529;The order account number can t be modified 
991530;Credit Limit position to decrement is negative  
991531;Type of position update is invalid - it must be equal 1 or 2 
991532;Account not authorized on Buy side  
991533;Account not authorized on Sell side 
991534;Account is Margin - the instrument must be Margin for this side   
991535;Buy order cannot be Short Sell 
991536;Sell order cannot be Buy Back 
991537;Buy or Sell order cannot be CROSS Short Sell and Buy Back   
991538;The Ishortsell indicator is invalid according of the side   
992002;Technical Error 
992003;Order price must be filled for limited orders   
992004;Order price must not be filled in for Opening, Market to limit and Market orders 
992005;Quantities must be multiple of traded lot 
992006;Type of price invalid or not authorized according to instr or GR state  
992007;Order quantity is equal to percentage of the Free Float Shares    
992008;Price must be valid against percent-tick parameter    
992009;CROSS orders forbidden in pre-opening stage 
992010;CROSS order price type must be limited    
992011;Total quantity must be greater than traded lot for a cross order  
992012;Order quantity exceeds percentage of the Free Float Shares  
992013;MARKET TO LIMIT order not supported by opposite limit 
992014;Price must be valid against tick table    
992015;Technical Error 
992016;FAK orders forbidden for MARKET and STOP-LOSS orders  
992017;Order quantity can not be increased 
992018;Invalid Date format 
992019;Validity date must be higher than current session date 
992020;Validity date must be lower than default date   
992021;Validity date must be equal to current session date   
992022;Amount exceeds capital amount authorized according to param CapMaxOmNg  
992023;Buy-Out Orders must have limit price and multiply quantity  
992025;Validity date of FAK, DAY or DEFAULT orders must not be filled    
992026;Validity date must be filled  
992027;One quantity is lower than Min Quantity for instrument 
992028;Disclosed or minimum quantity greater than total quantity   
992029;Min quantity forbidden for this order type 
992030;Technical Error 
992031;Disclosed quantity too small  
992032;Disclosed quantity forbidden for FAK,MOO,CROSS,MARKET and STOP-LOSS orders    
992033;This broker doesn’t t exist 
992034;Order cannot be entered for surveillance  
992035;Only surveillance can capture for another broker 
992036;Technical Error 
992037;Order sequential number must be numeric   
992038;Technical Error 
992040;Minimum quantity cannot be modified 
992041;This order is routed    
992042;No modification for the order 
992044;Validity date for this type of order must be FAK 
992045;This order is not in the book 
992046;Disclosed quantity cannot be greater than total or remaining qty  
992047;Technical Error 
992048;Unfreeze with acceptance impossible, Best orders not given  
992049;Cross order forbidden for STOP orders 
992050;Technical Error 
992051;Technical Error 
992052;Technical Error 
992053;MINIMUM QUANTITY forbidden for FAK order  
992054;Technical Error 
992055;TRIGGER PRICE format is invalid 
992056;TRIGGER PRICE must be valid against tick table  
992057;TRIGGER PRICE invalid for order type 
992058;STOP PRICE maxi-mini must be  >= TRIGGER PRICE  
992059;STOP PRICE maxi-mini must be <= TRIGGER PRICE   
992060;TRIGGER PRICE must be < last price or last day price  
992061;TRIGGER PRICE must be > last price or last day price  
992062;Remaining qty in book <> from expected remaining qty in order 
992063;Technical Error 
992064;This Trader does not belong to this Member 
992065;Trader Id cannot be updated   
992066;Origin date (in clearing aggregate) greater than current 
992069;Leg price is outside the thresholds 
992070;Technical Error 
992071;Price must be > 0 
992072;Foreign firm broker must be different from original broker  
992073;Technical Error 
992074;Technical Error 
992075;Order outside the thresholds because of related instrument  
992076;Short Sell indicator cannot be modified   
992099;Client account number must be numeric 
992100;Client account number is invalid    
992102;Order Create, Modify, Cancel forbidden at Supervisory Intervention stage    
992103;Hidden quantity forbidden in pre-opening stage  
992105;Buy order price must be < than the upper price threshold during AHM 
992106;Sell order price must be > than the lower price threshold during AHM    
992107;Cancelling an order better or equal than the TOP is forbidden 
992108;Cant decrease the price of buy orders participating in TOP calc   
992109;Cant decrease fin amount of buy orders participating in TOP calc 
992110;Cant increase the price of sell orders participating in TOP calculation 
992111;This Instrument is not allowed to trade in After Hour Market Session    
992112;Function forbidden on expired instrument  
992113;Function forbidden on not activated instrument  
992115;Total quantity must be inside the limits  
992116;Quantity exceeded the limit for AHM 
992117;Cant decrease the quantity of sell orders participating in TOP calc 
992118;Cant modify Stop order in preopening stage 
992129;Minimum quantity forbidden for STOP orders 
992130;Minimum quantity forbidden in pre-opening stage 
992137;Order price is outside the thresholds 
992138;Invalid order price 
992140;This instrument is not eligible for short selling 
992141;Only RSS orders are allowed for this instrument 
992142;Only PDT orders are allowed for this instrument 
992143;Technical Origin is suspended for this instrument 
992144;Short sell order not authorized on Buy Side 
992145;Short Sell order must be a Limit order    
992146;Short Sell order price does not comply with the Up_Tick rule 
992147;Invalid Order Technical Origin It must be filled with -R J V E P K W F 
992148;The Technical Origin is already suspended for this instrument 
992149;The Technical Origin is already activated for this instrument 
992200;Account not authorized to trade on this instrument 
992201;Account (2nd ag) not authorized to trade on this instrument 
992500;Confirmation mandatory for this order 
992501;Order handled in Pre Opening - rejected in Continuous Trading 
992502;Error, Instrument already in Fast-Market  
992503;Error, Instrument already in Slow-Market  
992504;Error, Instrument already in Very-Fast-Market   
992505;Credit Limit Cap exceeded 
992506;Percentage ownership exceeded 
992507;Held quantity of shares is insufficient   
992508;Credit Limit Cap and percentage ownership exceeded    
992509;Credit Limit Cap exceeded and held quantity of shares is insufficient   
992510;Percentage ownership exceeded and held qty of shares is insufficient    
992511;Credit Limit Cap, %ownership exceeded and held qty of shares insufficient 
992525;Error, Instrument already in Internal broadcast mode for Surveillance   
992600;The Member is NOT Liquidity provider for this Instrument    
992601;Buy price must be less or equal to sell price   
992602;Invalid price publicity type  
992603;Invalid broker type 
992604;Trader Id is invalid    
992605;Broker not allowed to enter a reference price   
992606;No Liquidity provider for this Instrument 
992900;Technical Error 
992901;Technical Error 
992903;Technical Error 
992904;Technical Error 
992908;Technical Error 
992910;Technical Error 
992911;Technical Error 
992917;Validity type of block must be Day  
992921;Technical Error 
992933;Technical Error 
992934;Technical Error 
992935;Technical Error 
992937;Technical Error 
992940;Technical Error 
992941;Technical Error 
992942;Technical Error 
992943;Technical Error 
992944;Technical Error 
992947;Technical Error 
992948;Technical Error 
992949;Technical Error 
992950;Technical Error 
992951;Technical Error 
992952;Technical Error 
993000;Instrument already suspended  
993001;Instrument already reserved   
993002;Instrument must be reserved or suspended  
993003;Instrument must be frozen 
993004;Instrument must be authorized 
993005;Instrument must be forbidden  
993006;No specialist broker for this instrument  
993007;Fixing time must be less than End Consultation time   
993008;No order to delete in the book 
993009;High limit must be greater to Low limit   
993010;Frozen price must be inside high and low limit  
993011;Reservation indicator must be different   
993012;Old Last day price invalid    
993013;Technical Error 
993014;Technical Error 
993015;Technical Error 
993016;A group or an instrument must be filled   
993017;Invalid datas for Low and high limits 
993018;The group has no instrument   
993019;The Group opening Time commands the Instrument s one  
993020;No opening time or fixing recorded for the Instrument 
993021;The opening-Fixing time must be greater than system Time    
993022;Opening Time must be < PostSession Time or PS Time must exists    
993023;TRADING-DATE must be > ORDER-ENTRY-DATE   
993024;Previous Lot size different from the current one 
993025;Previous H-L Limits different from current ones 
993026;Previous RefP-TLimit-ValiD different from the current ones    
993027;Previous maximum quantity (B/S) different from the current one    
993028;Technical Error 
993029;The Lot size or maximum quantity cannot be changed if there are orders in the Book 
993030;FIRST-LINE-REQUESTED must be filled 
993031;NBRE-LINES-REQUESTED must be filled 
993032;Selection is empty 
993033;Opening or Fixing already scheduled for this Time 
993034;Opening or Fixing already scheduled, Time entry rejected    
993035;Opening or Fixing already scheduled, Reset rejected   
993036;The Min and Max values entered are incorrect    
993037;The Max value must be greater than the Min value 
993038;The Posted Request to suppress is not in the REQUESTS table 
993039;There is no Request corresponding to selection in the REQUESTS table    
993040;High limit must be different than zero    
993041;The Tick limit must be equal or > 0 and < or equal to 100%  
993042;HOST ORDER NUMBER cannot be null    
993043;ORDER SIDE must be  A  or  V  
993045;The Times entered must be greater than the System Time 
993046;Opening or Fixing already scheduled, Cancel before    
993048;Time POST-SESSION is mandatory, unique and equal to last Time 
993049;All the Group event must have different scheduled Times 
993050;The After-Opening scheduled state must be at least 10 minutes after 
993051;Minimum delay between 2 scheduled Group events not respected 
993052;At Least 10 minutes between Opening and Surv-Interv   
993053;A State Change Time cannot be scheduled if State is the current one 
993060;This group does not exist 
993061;This group already exists 
993062;The OLD TEMP TICK LIMIT is invalid  
993063;The OLD DEFAULT TICK LIMIT is invalid 
993064;An indic value must be 0 or 1 
993065;The old value of an indicator is incorrect 
993066;Relative day 0 cannot have events with triggered time = 00:00:00  
993067;Data unchanged    
993068;PRICE VALIDITY DATE is wrong  
993069;Undefined currency for the instrument still forbidden 
993070;No Tick or Ref Price for the instrument, Instrument still forbidden 
993071;The concerned broker does not have the type MEMBER    
993072;The reservation indic must be  +  or  -  
993073;The entered date does not exist in the system calendar 
993074;There is no Variable Tick row for the specified criteria    
993075;The warrant is under automatic processing 
993094;Post-session timer must be > Instrument differed opening timer    
993095;Forbidden break after Interruption during end-consult stage 
993096;Restarting in Continuous impossible after a Market Interrupt 
993097;Impossible Upd, an Instrument has odd lots in the book 
993099;Previous Instr different from the current one  
993100;The Instrument Reference Price must be non null 
993101;If thresholds are null, Instr or Group Tick Limit must be non null 
993102;The temporary tick limit must be non null 
993103;The default Tick Limit must be non null   
993104;No valid tick for limit computed    
993105;Forbidden cancellation according to instrument state  
993106;The Last Adjusted Closing Price must be non null 
993107;The Request Time must be smaller or equal to System Time    
993108;Request already exists for the Instrument or the Group 
993109;Indic order cancellation can only take values 0,1,3  
993110;There are STOP orders for this Instr, Reset is rejected 
993111;Change displayed Qty is forbidden on STOP-AON orders  
993112;Incorrect value for Ref-Settl Price 
993113;Incorrect value for the Last Adjusted Closing Price   
993114;Trading Day indicator = 0 or 1 
993115;Session Template must be empty for day type  F  or  O 
993116;Day type incompatible with next day 
993117;Day type incompatible with previous day   
993118;First Default schedule time must have relative day value 0  
993119;Forbidden delete, instrument $$ state forbidden or frozen   
993120;Invalid Group Event code 
993121;Group state after opening empty or badly filled 
993122;Group state after opening must be filled only if Opening    
993123;Session template incompatible with market type associated to Group 
993124;Forbidden if one threshold or the reference price is null   
993125;Price type of CROSS phase must be filled only if pre-opening 
993132;State change invalid :  
993133;Scheduled time for the group are expired  
993134;Update canceled, the day does not exist in calendar   
993135;Invalid day type  
993136;Invalid matching algorithm type (A-F-2)   
993137;Matching algorithm type is already Allocation   
993138;Matching algorithm type is already FIFO   
993139;The reference price must be inside high and low limits 
993140;Invalid demand regarding current algorithm 
993150;Technical Error 
993151;Technical Error 
993152;Technical Error 
993153;Technical Error 
993154;The state of a leg doesn’t t allow this function  
993155;Technical Error 
993156;Technical Error 
993200;The Strategy type already exists    
993201;The Strategy type doesn’t exist 
993202;This strategy does not exist  
993203;This couple group-strategy type is already forbidden  
993204;This couple group-strategy type is not forbidden 
993205;The delay is not higher than the minimum delay  
993206;Max-Min leg must be between including 2-40 and Min = or < Max 
993207;A leg cannot be a Strategy    
993208;Number of legs must be between including Min and Max  
993209;The quantity type must be filled with Blank or AON    
993210;Number of legs is bad filled  
993211;The legs must have the same contract 
993212;All instrument codes in the reserved bracket are used 
993213;A similar strategy $$ already exists 
993214;The ratios must respect conditions on strategy type   
993215;Strategy not authorized for group   
993216;Authorization forbidden - transaction unauthorized for strategy    
993217;This function can not be captured for another broker  
993218;This strategy is forbidden for this quantity type 
993219;Invalid instrument code 
993220;Two legs of this strategy are similar 
993221;The leg $$ does not exist 
993222;The legs must respect conditions on strategy type 
993223;Command rejected, the couple group-strategy type is forbidden 
993224;This strategy cannot be a delta neutral   
993225;Invalid instrument type 
993226;Ratios must be less than 99   
993227;Stock thawn is rejected because the order is no more valid  
993228;Date was expired for the instrument 
993229;Command rejected, duration goes through the next stage 
993230;Strategy type must be filled  
993231;Indicator ratio authorized must be Y or N 
993232;Authorization to trade on strategy type must be Y or N 
993233;Inconsistent leg price algorithm ID 
993234;Same underlying indicator for a strategy must be Y or N
993235;Invalid number of legs  
993236;Ratio must be numeric   
993237;Ratio sign must be + or - 
993238;Inconsistent leg type   
993239;Too many legs for the number defined 
993240;Same leg defined several times 
993241;Leg number inconsistent regarding max legs 
993242;Strategy Type does not authorize to Trade 
993243;Function forbidden for this IXM 
993244;Implied orders forbidden for this strategy 
993245;Algorithm forbidden for this strategy 
993246;Algorithm value is forbidden for this strategy  
993247;The Lot size cannot be changed for implied strategy   
993248;Strategies cannot be thawed   
993249;Ratio or ratio sign inconsistent with leg price algorithm ID 
993250;At least one leg can t belong to the strategy   
993300;Technical Error 
993301;Technical Error 
993302;Technical Error 
993303;Technical Error 
993304;Technical Error 
993305;Technical Error 
993306;Technical Error 
993307;Technical Error 
993308;Trigger price outside allowed limits 
993309;Technical Error 
993400;Reservation with acceptation forbidden for cross/market to limit/Qty min 
993401;AON orders forbidden when Market Order are allowed   
993402;CROSS order price must be inside the limits 
993403;The cross quantity must be greater than total quantity to limit   
993404;Change the order side is forbidden  
993405;Bad ratio between disclosed and total quantity    
993410;Market Maker not authorized for Instrument 
993411;LP Order already in the book  
993412;Quote or order entry mode not allowed 
993413;Cross quote forbidden   
993414;Incoherent number of quote    
993415;Side must be A or V 
993416;Quantity side must be - or +  
993417;The mandatory field Posting Action is bad filled 
993418;The mandatory field Order user origin  is bad filled  
993419;The mandatory field Origin account is bad filled 
993420;Can t modify expiration date when IXM already expired 
993421;Inconsistent ratio regarding strategy type 
993422;Unknown quote in book   
993423;Couple Group-Associated group does not exist    
993424;An associated group already exists for this Group 
993425;This Group is already associated to another one 
993426;Action code must be D or C    
993427;No associated group for underlying IXM(s) 
993428;Associated groups must be different 
993429;Couple Group-Associated group already exists    
993430;Couple Group-broker does not exist  
993431;Associated groups must have the same op-val-grc 
993432;Association impossible : groups now definitively in <> Trading Units    
993433;Function forbidden - Quotes still in the order book   
993450;Automaton Level is bad filled 
993451;Variation Side is bad filled  
993452;Beginning Time or-and Ending Time is bad filled 
993453;Percentage of Variation is bad filled 
993454;Group Opening Delay is bad filled   
993455;Action Code must be C or D    
993456;Index Code is bad filled 
993457;The Index Code doesn't t exit   
993458;One or more Groups is bad filled    
993459;Technical error on Action Code 
993460;ICB : Error when programming schedule on group  
993461;ICB : Error on group interruption   
993462;ICB : Error on group interdiction   
993463;Automate Level cannot be modified, try later    
993464;No corresponding data in table 
993465;ICB : The robot ICB is just deactivate    
993466;ICB : Level 1 has been triggered    
993467;ICB : Level 2 has been triggered    
993468;ICB : Level 3 has been triggered    
993500;Unknown Dealer 
993501;Order price outside the limits NBBO 
993502;Quantity must be greater than minimum improvement quantity  
993503;Invalid phase number    
993504;Improvement period already started  
993505;Only price must be updated    
993506;Price must be better than last initial price    
