error_code;description
993507;Invalid improvement quantity  
993508;Only price and quantity must be updated   
993509;Unknown management type 
993510;Unknown improvement type 
993511;Maximum price must be better than price   
993512;Mandatory field client account is not filled    
993513;Mandatory field trader order number is not field 
993514;Improvement order forbidden for dealer    
993515;Forbidden improvement phase for IXM 
993516;Invalid improvement side 
993517;Forbidden update for automatic phase 
993518;One IXM hasn t got an improvement tick    
993519;Inconsistent improvement tick 
993520;Improvement phase to be in progress, Minimum quantity forbidden   
993521;Deferred opening on IXM  
993522;Maximum improvement price must be filled  
993523;Quantity must be greater than last improvement quantity 
993524;Order Account type is Incoherent with Combined Order Type   
993525;Forbidden exposition for group 
993526;NBBO crossed 
993532;Lot size greater than Maximum Quantity of Instrument  
993550;implied orders forbidden for strategy 
993551;Number of legs forbidden for implied 
993552;Ratio inconsistent for implied 
993553;Lot size or tick inconsistent for implied 
993901;Unknown order in book   
993902;Old priority invalid for database   
993903;New and Old priority are equal 
993904;Priority already exists 
993905;Priority hour greater than current time   
993906;Old shown qty is not equal to database    
993907;Displayed quantity is not multiple from trade unit    
993908;New and Old quantity are equal 
993909;New Displayed qty greater than disclosed quantity 
993910;New Displayed quantity greater than left quantity 
993911;Trade hour greater than current 
993912;Traded quantity less than trade unit 
993913;Traded quantity not multiple of trade unit 
993914;Invalid trade price 
993915;The brokers are not member firms    
993916;Cancel trade date not equal to current    
993917;Trade does not exist    
993918;Invalid trade price against tick table    
993919;trade hour must be greater than last trade hour 
993920;Invalid hour format 
993921;Trade hour must be less than last trade hour    
993922;Order MUST have a hidden Qty in order to change its displayed Qty 
993923;Trade rejected: its price crosses STOP orders in the book   
993924;Delay till first asked time is too short or first time is obsolete 
993925;Next to Last price and Last adj closing price are invalid   
993926;Cancel is impossible: Ask Stop with trigg price > next to last traded  
993927;Cancel is impossible: Bid Stop with trigg price < next to last traded  
993928;Trade must be inside the price thresholds 
993929;Cancel impossible : this trade is linked to Strategy Trade  
993930;Cancel trade impossible : No order found  
993931;This trade number is already used   
993932;Cancel trade impossible : No order found  
993933;Number of transaction and date can t be filled for a Strategy 
993934;Trade number must be < last trade number of the instrument concerned    
993999;The OBBP and the CP are allowed only in auction trading 
994001;Parameter Threshold 
994002;Parameter Quantity  
994004;Parameter Quantity  
994006;Parameter Price     
994008;Only one field should be informed   
994009;One or more group(s) must be selected 
995500;SQL Error, Advise Computer staff    
995501;SQL tables mismatch, Advise computer staff 
995502;No anomalies itemized   
995503;Invalid Group-user, Access denied   
995504;Invalid password, Access denied 
995505;Password expired, please update it  
995506;Captured data unknown in database   
995507;You re not authorized to break this screen 
995508;Direct screen break for this screen 
995509;Your logon was changed Please logon again 
995510;Data were created 
995511;Data were updated 
995512;Date were deleted 
995513;Logon authorization doesn’t allow to execute this function    
995514;Data already exist 
995515;Invalid new password    
995516;Invalid id code, advise production staff  
995517;0000 screen access must be authorized 
995518;Invalid screen (check nb-authorization)   
995519;SLE Id unknown in SDF Frontend file 
995520;NSC unknown in SDF Frontend file    
995521;Technical Error 
995522;Technical Error 
995523;Technical Error 
995524;Technical Error 
995525;Technical Error 
995526;Technical Error 
995527;Technical Error 
995528;Technical Error 
995529;No member authorization for the Group 
995530;No Group authorization for the member 
995531;No group defined in NSC database    
995532;No member defined in NSC database   
995533;Surveillance broker, no update allowed    
995534;broker is not Market maker for the instr  
995535;Delete canceled, trader is connected 
995536;Delete canceled, associated instruments still exist   
995537;Server name invalid 
995538;Data were read    
995539;Delete canceled, associated groups still exist  
995540;Min price too low 
995541;Min price too high 
995542;Last page raised  
995543;Invalid key Too many field captured 
995544;Invalid key Tick not captured 
995545;Invalid key for Tick and  min price compute    
995546;Cotation Step to low compare to nb decimal ext  
995547;Cotation Step price must be filled  
995548;Delete canceled, Variable tick table index still use  
995549;Class code doesn’t exist 
995550;Server launched   
995551;Launch canceled   
995552;Batch mode doesn’t allow this function    
995553;File in use try later   
995554;Update canceled, profile does not exist   
995555;Surveillance broker does not exist  
995556;Profile does not exist  
995599;Error message doesn’t exist   
995998;Cancel orders in progress 
995999;Error on open file /File doesn’t exist or error of securities/    
996000;Empty file  
996001;Invalid record type 
996002;Invalid File name 
996003;Invalid date 
996004;Invalid record number   
996005;Existing record after footer record 
996006;IXM code not numeric    
996007;Footer record not found 
996008;Header record not found 
996009;Mandatory Data    
996010;IXM type must be F, C, P  or S 
996011;Validity date type must be E, D, J, F ou S 
996012;NOt numeric data  
996013;Not numeric under IXM code   
996014;Under IXM filled and indicator not present 
996015;Invalid price format    
996016;Strike fill strike currency code missing 
996017;strike currency filled, strike missing    
996018;H-L variation type expression is <> 1 or 2 
996019;records chaining impossible for the Instrument  
996020;Date-hour expired for record type I or C  
996021;Underlying Instr not filled while indic fill    
996022;Settle Indicator must be  blanK, N or C   
996023;Settle Indicator inconsistent 
996024;Settle Indicator must be 0 or 1 
996025;Price definition must be 1, 2 or blank    
996026;Exp date must be >= Activ date    
996027;Matching code must be A or F  
996028;Exp and activ date must be > system date 
996029;Unknown Instrument in NSC-C Database 
996030;Instrument already exists in NSC-C Database 
996031;IXM code conversion Error Ask technical support 
996032;Max Quantity must be greater than Min Quantity  
996033;Low limit must be lower than High limit   
996034;Invalid Margin Rate 
996035;Credit class must be blank    
996036;Stop orders to cancel, command must be confirmed 
996037;Technical Error 
996038;Technical Error 
996039;Technical Error 
996040;Technical Error 
996041;Variable tick table index does not exist  
996042;Technical Error 
996043;Invalid tick 
996044;Minimum price already existes 
996045;Invalid APF price 
996046;A zero minimum price is mandatory   
996047;File size limited to 50 instruments for this request  
996048;There are dupplicate instruments in the list    
996100;Trader authorization doesn’t exist  
996101;Trader authorization already created 
996230;No Group authorization for the Trader 
996231;Group not authorized for this Trader 
996232;Group not authorized on Buy Side for this Trader 
996233;Group not authorized on Sell Side for this Trader 
996234;Couple Group/Trader does not exist  
996235;This Trader does not exist    
996236;If Member/group author is checked, Bid or Ask auth must also be checked 
996237;If Trader/Group author is checked, Bid or Ask auth must also be checked 
996238;Member / Trader does not exist in traders table   
997000;Invalid market type (cash or futures)    
997001;KUR not to be fill in (cash) 
997002;NDS account clearer not to be fill in (cash)   
997003;NIK not to be fill in (cash) 
997004;Nik sub account not to be fill in (cash) 
997005;Client inst id not to be fill in (futures) 
997006;Broker not found in TFINT    
997007;Clearer not found in TFINT   
997008;Broker not found in TFABI    
997009;Clearer not found in TFABI   
997010;Client-Clearer not found in TFKKL  
997011;Inactive link between Client -Clearer   
997012;Broker-Clearer not found in TFUUR  
997013;Inactive link between Broker -Clearer   
997014;Date of settlement invalid or not found  
997015;Date of settlement < Session Date  
997016;Value limit overload during pre opening  
997017;Value limit overload during session 
997018;Trade quantity invalid during pre opening 
997019;Trade quantity invalid during session    
997020;Declaration cancelled by surveillance    
997021;Declaration cancelled by broker    
997022;The quantity between the two counterpart are different 
997023;The price between the two counterpart are different  
997024;Declaration has been eliminated    
997025;Accrued interest not found in TFCOUPON   
997026;Invalid type of value  
997027;Type of settlement not found in TFDELAI  
997028;Client not found in TFINT    
997029;Client not found in TFABI    
997030;IBO and IAO group states allowed only for fixing group 
997031;It is not a specialist of the instrument 
997032;To modify it must be assigned to same broker which created it    
997033;The order side can t be modified   
997034;The instrument id can t be modified 
997035;The new quantity order must be >= than the old quantity    
997036;The new price must be >= than the old for a buy (less for a sell) 
997037;The orders at opening price cannot be modified 
997038;The Market orders cannot be modified in pre-opening mode   
997039;Modification is limited to 3% 
997040;There is no modification 
997041;Only limited order on crossing phase 
997042;Only limited orders at the last quoted price on crossing phase   
997043;No cross available 
997044;Client-Negotiator not found in TNG 
997045;Negotiator already exists in TNG   
998001;Identificar Titular (Define owner) 
998002;Titular nao existe (Owner not found) 
998003;Titular/Digito invalid (Invalid Owner) 
998004;Titular sem posicao (Owner without position) 
998005;Qtde p/Exercicio > posicoes (Exercise Qty > position) 
998006;Oscilacao incondicional (Unconditional oscillation) 
998007;Nao ha posicoes (Position not found) 
998008;Corretora nao preenchida (Firm not provided) 
998009;Corretora invalida (Invalid Firm) 
998010;Bloqueio suspenso (Blocking suspended) 
998011;Nao e vencimento Opcoes (Invalid Option expiration date) 
998012;Identificar Lancador (Define Issuer) 
998013;Codigo Papel invalid (Invalid Symbol) 
998014;Funcao fora do horario (Function outside scheduled time) 
998015;Qtde p/Bloqueio > 999999999 (Blocking Qty > 999999999) 
998016;Erro de falta de E (Missing E) 
998017;Qtde p/Bloqueio > posicoes (Blocking Qty > position) 
998018;Numero do Negocio Invalido (Invalid trade number) 
998019;N/A 
998020;Negocio inexistente p/Bloqueio (Trade not found for blocking) 
998021;Qtde p/Blq > Qtde Negocio (Blocking Qty > Trade Qty) 
998022;Nao ha mais lancadores p/exercer (No issuers available to Exercise) 
998023;Erro Tecnico (Technical Error) 
998024;Negocio de Opcoes Anulado (Options trade canceled) 
998025;Codigo do ITF invalid (Invalid ITF code) 
998026;N/A 
998027;Saldo p/Bloquear zerado (Blocking balance is zero) 
998028;Operacao inval p/tipo Papel (Operation not supported for this Instrument) 
998029;Erro Tecnico (Technical Error) 
998030;Corr Comp inval p/AnulExe (Invalid Firm on buy side for Exercise cancelation) 
998031;N/A 
998032;Corr Vend inval p/AnulExe (Invalid Firm on sell side for Exercise cancelation) 
998033;Cliente invalido p/Anul Exe (Invalid Client for Exercise cancelation) 
998034;Qtde invalida p/Anul Exerc (Invalid Qty for Exercise cancelation) 
998035;Lancador n/existe (Issuer not found) 
998036;Erro Tecnico (Technical Error) 
998037;N/A 
998038;N/A 
998039;Erro Tecnico (Technical Error) 
998040;Corr Comp inval p/Bloqueio (Invalid Firm on buy side for Blocking) 
998041;Erro Tecnico (Technical Error) 
998042;Erro Tecnico (Technical Error) 
998043;Bloqueio ja Anulado (Blocking already canceled) 
998044;Neg s/vinculo p/AnlBloqueio (No related trade for Blocking cancelation) 
998045;Negocio Opcoes ja Anulado (Optiond trade already canceled) 
998046;Exercicio ja Anulado (Exercise already canceled) 
998047;Grupo n/localizado no TOPCTRL (Group not found in TOPCTRL) 
998048;Erro Tecnico (Technical Error) 
998049;N/A 
998050;Erro Tecnico (Technical Error) 
998051;Erro Tecnico (Technical Error) 
998052;N/A 
998053;Erro Tecnico (Technical Error) 
998054;Erro Tecnico (Technical Error) 
998055;Dados divergentes p/Bloqueio (Divergent data for Blocking) 
998056;Negocio inexistente AnlBlq (Invalid trade number for individual Blocking cancelation) 
998057;Erro Tecnico (Technical Error) 
998058;Bloq ja Anulado Individual (Individual Blocking already canceled) 
998059;Codneg p/Anl-Blo indiv errado (Invalid trade number for individual Blocking cancelation) 
998060;Corret p/Anl-Blo indiv errado (Invalid Firm for individual Blocking cancelation) 
998061;Cliente p/Anl-Blo indiv errado (Invalid Client for individual Blocking cancelation) 
998062;Qtde p/Anl-Blo indiv errado (Invalid Qty for individual Blocking cancelation) 
998063;Erro Tecnico (Technical Error) 
998064;Erro Tecnico (Technical Error) 
998065;Erro Tecnico (Technical Error) 
998066;N/A 
998067;Lancador/Digito invalid (Invalid Issuer) 
998068;Bloqueio Efetuado (Blocking processed) 
998069;Bloqueio Anulado (Blocking Canceled) 
998070;Bloqueio Parcial (Partial Blocking) 
998071;Exercicio Efetuado (Exercise processed) 
998072;Exercicio Anulado (Exercise Canceled) 
998500;O PAPEL JA PERTENCE A UM PROMOTOR (Stock already has a Promoter owner) 
998501;CORRETORA INVALIDA (Invalid Firm) 
998502;CORRETORA NAO CADASTRADA (Firm not found) 
998503;INDICADOR INVALIDO (Invalid indicator) 
